Title,Division,Subject,Course,Hours,CRN,Instructor,Meeting Days,Meeting Times,Grade Mode,Status,Current Capacity,Max. Capacity,Waitlist,Waitlist Max,Description
Calculus 2,5,MST,112,4,167233,Dr. Kirkman ,TR,12:00-1:15pm,letter ,Open,18,18,2,2,"Techniques of integration, indeterminate forms, improper integrals, transcendental functions, sequences, Taylor’s formula, and infinite series, including power series. Lab"
Discrete Math ,5,MST ,117,4,229789,Dr. Moore ,MWF,2:00-2:50pm,letter ,Open,18,18,2,2,"Introduction to various topics in discrete mathematics applicable to computer science including sets, relations, Boolean algebra, propositional logic, functions, computability, proof techniques, graph theory, and elementary combinatorics."
Linear Algebra ,5,MST,121,4,509881,Dr. Smith ,TR,11-12:15pm,letter ,Open,18,18,2,2,"Vectors and vector spaces, linear transformations and matrices, determinants, eigenvalues, and eigenvectors. Credit not allowed for both 121 and 205. Lab."
Introduction to Linear Algebra and Differential Equations,MST,MST,205,4,295850,Dr. Bourdon,TR,9:00-10:15,Letter,Open,18,18,2,2,"Specific topics covered include: vector algebra, solving linear systems of equations, rank, vector spaces, determinants, eigenvalues, linear transformations, first order differential equations, second order linear ordinary differential equations, and power series solutions to differential equations."
Applied Matrix Algebra and Selected Topics,MST,MST,206,2,482050,Dr. Ferraro,MWF,2:00-2:50,Letter,Open,18,18,2,2,"Matrices, determinants, solutions of linear equations, special matrices, eigenvalues and eigenvectors of matrices. Additional topics will be covered as time permits. Not to be counted toward any major offered by the department except for the major in mathematical business."
